{
  "schemaVersion": "c4-gate-diagnostics-execution-contract.v1",
  "contractVersion": "1.0.0",
  "diagnosticsId": "c4-gate-diagnostics-from-frozen-c2-c3-feature-evidence",
  "status": "DIAGNOSTICS_ONLY_NON_AUTHORITATIVE",
  "baseline": {
    "featureEvidenceTargetCommit": "f564c0ca18387ab4a07144522ec8ce0c0df9ff62",
    "featureEvidenceContentHash": "cf3473c4343a88e3db7ac3e6526ef44ed2ce8a54bd1e3f93e13047de4b5a976c",
    "approvedState": "NOT_READY_NON_AUTHORITATIVE",
    "finalGeneratorReady": false
  },
  "inputArtifacts": [
    {
      "path": "data/calibration/preflight/c4_feature_admission_execution_contract.v1.json",
      "rawSha256": "77b81a75cadce7e24d2b8a8b6e90207694723b73a6bda2e335795fbf482fd14b",
      "canonicalHash": "c2b960b4465f6e8b0755d30ad721618b5454f957462aa236bde283365e59893a"
    },
    {
      "path": "data/calibration/preflight/c4_feature_admission_evidence.v1.json",
      "rawSha256": "ad1f7ff2030071528995b4de21da8777d87626289912628a5f3e9e2b55b977c7",
      "canonicalHash": "cf3473c4343a88e3db7ac3e6526ef44ed2ce8a54bd1e3f93e13047de4b5a976c"
    },
    {
      "path": "data/calibration/preflight/c4_generation_preflight.v1.json",
      "rawSha256": "50187193d0a4cb1fec8b3d190431ff98806034cf36fae2aa980e1c932e3ab916",
      "canonicalHash": "323bf1d117d0511cb40891a02a161e052682e9aa8938f33ddbad6ce732fc5843"
    },
    {
      "path": "data/calibration/exploration/c3_execution_contract.v1.json",
      "rawSha256": "bb7841b8925bd64ee5e07767098d5f12db3b1d55fdd142c78c24ba207f3725a5",
      "canonicalHash": "9c9b3fab9f7def56bbe66d2e1464d278dde345d24dc37fc3e49e6dd883eafd48"
    },
    {
      "path": "data/calibration/exploration/c3_exploration_summary.v1.json",
      "rawSha256": "9cc34aca524d6c9ec0ffb1c957f573e1145527cc4425b9bb379b15d87958036a"
    },
    {
      "path": "data/calibration/exploration/c3_uncertainty_register.v1.json",
      "rawSha256": "341c9a3e08c582c82cf3e173660f7e4d822d34bbeee0ad2d36345df312773d2a"
    },
    {
      "path": "data/calibration/exploration/c3_exploration_manifest.v1.json",
      "rawSha256": "e76a65aa274634ccebd54ff50f0e54c1d04a3bf65e12aa43601906fce4041846"
    },
    {
      "path": "data/calibration/pilot/normalized_observations.v1.json",
      "rawSha256": "2ddf22030106f92b906510b926bf40855e8879e5faca67d43ed9ade31cb6078a"
    },
    {
      "path": "data/calibration/pilot/quality_diagnostics.v1.json",
      "rawSha256": "e4b4c07136f94992d63813ee34b6cf0111ee7953dab39fc964167e86f96e9b8a"
    },
    {
      "path": "data/calibration/pilot/snapshot_manifest.v1.json",
      "rawSha256": "bcdf0cefe0d6e6ac6b223198a5e076d4228fcaff354fe203c26f7343323bf8fa"
    },
    {
      "path": "data/calibration/pilot/pilot_report.v1.json",
      "rawSha256": "3c8fe27f685b001ecfe73476fddf85ec32a71b1b239d70aad73ccf76d2c56a21"
    },
    {
      "path": "data/calibration/variable_registry.v2.json",
      "rawSha256": "94b8b1a907410a0ed80b0378b3b040884d6f8fd974f096c0af29c7c01e286266"
    }
  ],
  "missingnessStrategyCandidates": [
    {
      "strategyId": "PRESERVE_NULL_NO_IMPUTATION",
      "fillsValuesWhenRun": false,
      "executionStatus": "DIAGNOSTIC_CANDIDATE_NOT_SELECTED"
    },
    {
      "strategyId": "VARIABLE_AVAILABLE_CASE_NO_IMPUTATION",
      "fillsValuesWhenRun": false,
      "executionStatus": "DIAGNOSTIC_CANDIDATE_NOT_SELECTED"
    },
    {
      "strategyId": "COMMON_GRID_COMPLETE_CASE_NO_IMPUTATION",
      "fillsValuesWhenRun": false,
      "executionStatus": "DIAGNOSTIC_CANDIDATE_NOT_SELECTED"
    },
    {
      "strategyId": "OWNER_APPROVED_IMPUTATION",
      "fillsValuesWhenRun": true,
      "executionStatus": "NOT_RUN_OWNER_DECISION_REQUIRED"
    }
  ],
  "vintagePolicy": {
    "comparablePairRule": "SAME_SOURCE_AND_CANONICAL_REQUEST_PARAMETERS_WITH_DISTINCT_RETRIEVALS",
    "periodDifferenceIsVintageEvidence": false,
    "differentQueryIsVintageEvidence": false,
    "missingSourceAsOfSupportsStability": false
  },
  "sectorDiagnosticPolicy": {
    "observedComponentVariableIds": [
      "agriculture_value_added_pct_gdp",
      "manufacturing_value_added_pct_gdp",
      "services_value_added_pct_gdp"
    ],
    "availableComponentSumDataClass": "DERIVED",
    "totalReconciliationStatus": "NOT_RUN_NON_EXHAUSTIVE_COMPONENT_SET",
    "industryTotalMayBeAddedToManufacturing": false
  },
  "tradeDiagnosticPolicy": {
    "reportedFlowDataClass": "OBSERVED",
    "mirrorDifferenceDataClass": "DERIVED",
    "exactDuplicateWeighting": "ONE_DISTINCT_OBSERVATION_ID_PER_PAIR_SIDE",
    "reconciliationStatus": "NOT_RUN_NO_AVERAGING_NO_IPF_RAS"
  },
  "hardBoundaries": [
    "NO_VALUE_IMPUTATION",
    "NO_MISSINGNESS_STRATEGY_SELECTION",
    "NO_VINTAGE_STABILITY_CLAIM_WITHOUT_COMPARABLE_SNAPSHOTS",
    "NO_SECTOR_TOTAL_CLAIM_FROM_PARTIAL_COMPONENTS",
    "NO_TRADE_MIRROR_AVERAGING_OR_RECONCILIATION",
    "NO_IPF_RAS",
    "NO_ARCHETYPE_OR_FICTIONAL_COUNTRY_GENERATION",
    "NO_WORLD_CORE_OR_RUNTIME_IMPORT_OR_MUTATION",
    "NO_SUPABASE_OR_PRODUCTION_DATABASE_ACCESS",
    "NO_LIVE_PROVIDER_NETWORK_RETRIEVAL",
    "NO_FINAL_70_COUNTRY_PACKAGE"
  ]
}
